{
  "schema_version": 2,
  "suite_id": "phase4-entry-behavior-v2",
  "catalog_snapshot_id": "p2-41649744e057d61031d5",
  "reviewed_at_utc": "2026-10-26T00:00:00Z",
  "source_suite": {
    "suite_id": "phase3-entry-behavior-v1",
    "path": "contracts/lab/automation/v1/fixtures/behavior-suite.phase3-v1.json",
    "sha256": "6e774679f25515a1de5516c0152c7f94e874cca4d3beee918bfca834e80077d2"
  },
  "entries": [
    {
      "registry_entry_id": "nb-4528cf6bfb6a315278ba2dd7",
      "ecosystem": "nonebot",
      "package": "nonebot_plugin_strman",
      "version": "1.2.0",
      "artifact_sha256": "6adbac521fdf49781c03d0de47107079a3889787ecc89fb25630aefb15328d33",
      "dependency_locks": {
        "linux-x86_64": {
          "status": "eligible_not_run",
          "profile_id": "nonebot-2.5.0-onebot-2.4.6-py3.12.14-linux-x86_64",
          "dependency_lock_sha256": "56fc06e74e99731b00e24aa560dd47389f3f339b7094ec69b5e9c0cb112dc079",
          "artifact_sha256": "6adbac521fdf49781c03d0de47107079a3889787ecc89fb25630aefb15328d33"
        },
        "windows-x86_64": {
          "status": "eligible_not_run",
          "profile_id": "nonebot-2.5.0-onebot-2.4.6-py3.12.14-windows-x86_64",
          "dependency_lock_sha256": "3c8d3fc9439f4b6f6b3565312e07eb38100713d195c7e8ac040c10b04e80c0bc",
          "artifact_sha256": "6adbac521fdf49781c03d0de47107079a3889787ecc89fb25630aefb15328d33"
        }
      },
      "source_review": {
        "archive_member": "nonebot_plugin_strman/parser.py",
        "symbols": [
          "Parser.__call__",
          "Parser._tag_parse"
        ],
        "reviewed_artifact_sha256": "6adbac521fdf49781c03d0de47107079a3889787ecc89fb25630aefb15328d33",
        "review_status": "reviewed",
        "external_services": [],
        "archive_member_sha256": "105d42fee3ef2d7b01fd3609169deea2a1b34839318ae8094255c9a921fbfc8d"
      },
      "cases": [
        {
          "case_id": "nb-nonebot-plugin-strman-positive",
          "class": "positive",
          "migration": {
            "status": "blocked",
            "reason_code": "structured_adapter_setup_oracle_review_required",
            "v1_case_id": "nb-nonebot-plugin-strman-positive",
            "v1_input": "parse known tag and format {name}",
            "v1_assertions": [
              {
                "path": "plugin_observation.response_or_operation_count",
                "operator": "in_range",
                "minimum": 1,
                "maximum": 1
              }
            ],
            "v1_oracle": {
              "member": "nonebot_plugin_strman/parser.py",
              "symbol": "Parser.__call__",
              "rationale": "Parser resolves dotted tags, formats supplied values, and raises KeyError for unknown tags.",
              "review_status": "reviewed"
            }
          },
          "adapter": null,
          "setup": null,
          "stimulus": null,
          "determinism": null,
          "observation": null,
          "oracle": null
        },
        {
          "case_id": "nb-nonebot-plugin-strman-negative",
          "class": "negative",
          "migration": {
            "status": "blocked",
            "reason_code": "structured_adapter_setup_oracle_review_required",
            "v1_case_id": "nb-nonebot-plugin-strman-negative",
            "v1_input": "resolve missing tag",
            "v1_assertions": [
              {
                "path": "plugin_observation.response_or_operation_count",
                "operator": "equals",
                "value": 0
              }
            ],
            "v1_oracle": {
              "member": "nonebot_plugin_strman/parser.py",
              "symbol": "Parser._tag_parse",
              "rationale": "Negative boundary derived from Parser resolves dotted tags, formats supplied values, and raises KeyError for unknown tags.",
              "review_status": "reviewed"
            }
          },
          "adapter": null,
          "setup": null,
          "stimulus": null,
          "determinism": null,
          "observation": null,
          "oracle": null
        },
        {
          "case_id": "nb-nonebot-plugin-strman-isolation",
          "class": "isolation",
          "migration": {
            "status": "blocked",
            "reason_code": "structured_adapter_setup_oracle_review_required",
            "v1_case_id": "nb-nonebot-plugin-strman-isolation",
            "v1_input": "explicit profile override result does not mutate default",
            "v1_assertions": [
              {
                "path": "plugin_observation.scope_leak_count",
                "operator": "equals",
                "value": 0
              }
            ],
            "v1_oracle": {
              "member": "nonebot_plugin_strman/parser.py",
              "symbol": "Parser._tag_parse",
              "rationale": "Independent-state oracle derived from Parser resolves dotted tags, formats supplied values, and raises KeyError for unknown tags.",
              "review_status": "reviewed"
            }
          },
          "adapter": null,
          "setup": null,
          "stimulus": null,
          "determinism": null,
          "observation": null,
          "oracle": null
        }
      ]
    },
    {
      "registry_entry_id": "nb-5f9a0398ba3644f4256bbe83",
      "ecosystem": "nonebot",
      "package": "nonebot_plugin_guess",
      "version": "0.1.9",
      "artifact_sha256": "db6b9bfefdcd80d4e9da03f2b136a0d11c7e1a08cad3c378cac8eda573929957",
      "dependency_locks": {
        "linux-x86_64": {
          "status": "eligible_not_run",
          "profile_id": "nonebot-2.5.0-onebot-2.4.6-py3.12.14-linux-x86_64",
          "dependency_lock_sha256": "14cc422be4f8924a83f47e02bb9572dc00b03db62cb4a893a7102aa0e739814a",
          "artifact_sha256": "db6b9bfefdcd80d4e9da03f2b136a0d11c7e1a08cad3c378cac8eda573929957"
        },
        "windows-x86_64": {
          "status": "eligible_not_run",
          "profile_id": "nonebot-2.5.0-onebot-2.4.6-py3.12.14-windows-x86_64",
          "dependency_lock_sha256": "53a9b73a466840d8fde894da1cbf067a77bc1a3d6e06aa3bb96092b752605b47",
          "artifact_sha256": "db6b9bfefdcd80d4e9da03f2b136a0d11c7e1a08cad3c378cac8eda573929957"
        }
      },
      "source_review": {
        "archive_member": "nonebot_plugin_guess/guess.py",
        "symbols": [
          "guess",
          "process",
          "handle"
        ],
        "reviewed_artifact_sha256": "db6b9bfefdcd80d4e9da03f2b136a0d11c7e1a08cad3c378cac8eda573929957",
        "review_status": "reviewed",
        "external_services": [],
        "archive_member_sha256": "1f0fa1861e8fbb2bf490ae726011d864f59f517fa5dd1eb226a4cf6e4e418c1e"
      },
      "cases": [
        {
          "case_id": "nb-nonebot-plugin-guess-positive",
          "class": "positive",
          "migration": {
            "status": "blocked",
            "reason_code": "prior_candidate_failed_preserved",
            "v1_case_id": "nb-nonebot-plugin-guess-positive",
            "v1_input": "invoke /guess with fixed seed",
            "v1_assertions": [
              {
                "path": "plugin_observation.response_or_operation_count",
                "operator": "in_range",
                "minimum": 1,
                "maximum": 1
              }
            ],
            "v1_oracle": {
              "member": "nonebot_plugin_guess/guess.py",
              "symbol": "guess",
              "rationale": "The source declares /guess and aliases; module globals idx/city create a state leakage risk captured by the isolation oracle.",
              "review_status": "reviewed"
            }
          },
          "adapter": null,
          "setup": null,
          "stimulus": null,
          "determinism": null,
          "observation": null,
          "oracle": null
        },
        {
          "case_id": "nb-nonebot-plugin-guess-negative",
          "class": "negative",
          "migration": {
            "status": "blocked",
            "reason_code": "prior_candidate_failed_preserved",
            "v1_case_id": "nb-nonebot-plugin-guess-negative",
            "v1_input": "send unrelated text",
            "v1_assertions": [
              {
                "path": "plugin_observation.response_or_operation_count",
                "operator": "equals",
                "value": 0
              }
            ],
            "v1_oracle": {
              "member": "nonebot_plugin_guess/guess.py",
              "symbol": "handle",
              "rationale": "Negative boundary derived from The source declares /guess and aliases; module globals idx/city create a state leakage risk captured by the isolation oracle.",
              "review_status": "reviewed"
            }
          },
          "adapter": null,
          "setup": null,
          "stimulus": null,
          "determinism": null,
          "observation": null,
          "oracle": null
        },
        {
          "case_id": "nb-nonebot-plugin-guess-isolation",
          "class": "isolation",
          "migration": {
            "status": "blocked",
            "reason_code": "prior_candidate_failed_preserved",
            "v1_case_id": "nb-nonebot-plugin-guess-isolation",
            "v1_input": "a second session does not inherit active game state",
            "v1_assertions": [
              {
                "path": "plugin_observation.scope_leak_count",
                "operator": "equals",
                "value": 0
              }
            ],
            "v1_oracle": {
              "member": "nonebot_plugin_guess/guess.py",
              "symbol": "handle",
              "rationale": "Independent-state oracle derived from The source declares /guess and aliases; module globals idx/city create a state leakage risk captured by the isolation oracle.",
              "review_status": "reviewed"
            }
          },
          "adapter": null,
          "setup": null,
          "stimulus": null,
          "determinism": null,